<?xml version="1.0" encoding="UTF-8" standalone="no"?>
<!DOCTYPE hierarchy PUBLIC "-//Novell, Inc.//DTD hierarchy 2.0//EN" "http://www.Novell.com/dtds/hierarchy_2.0.dtd">
<hierarchy>

<!--
   This Hierarchy File is automatically generated by BDI to allow the BDI Definition to function properly.
   Do not hand edit this Hierarchy File or the BDI Integration may not function properly.
   Any desired modifications should be made within the BDI IDE and the definition re-deployed.
-->


<!--Top-level Hierarchy XML Start-->
q
<!--Top-level Hierarchy XML End-->

  <group affected="no" class="_ID21_Services" name="Services">
    <generator affected="yes" class="_ID23_Sistema" field="_ID23_ChiaveSistema">
      <generator affected="yes" class="_ID24_Sottosistema" field="_ID24_SottosistemaKey" hold="yes">
        <generator affected="yes" class="_ID25_Application" field="_ID25_ApplicationKey" hold="yes">
          <generator affected="yes" class="_ID26_Tecnologico" field="_ID26_ChiaveTecnologico">
            <generator affected="yes" class="_ID27_Infrastruttura" field="_ID27_InfrastrutturaKey" hold="yes"/>
          </generator>
        </generator>
      </generator>
    </generator>
  </group>
  <group affected="no" class="_ID22_Servers" name="Servers">
    <generator affected="yes" class="_ID32_Servers" field="_ID32_ServersKey" hold="yes"/>
  </group>
  <group affected="no" class="_ID35_Relations" name="Relations">
    <generator affected="yes" class="_ID36_Rel_HW2Infra" field="_ID36_chiaveD"/>
    <generator affected="yes" class="_ID30_Rel_ClusterServer" field="_ID30_ChiaveRel"/>
  </group>
  <group affected="no" class="_ID11_Dashboard" name="Dashboard">
    <generator affected="yes" class="_ID12_LivelloSistema" field="_ID12_ChiaveSistema">
      <generator affected="yes" class="_ID16_LivelloSottoSistema" field="_ID16_LivelloSottoSistemaKey" hold="yes">
        <generator affected="yes" class="_ID17_LivelloApplication" field="_ID17_LivelloApplicationKey" hold="yes">
          <generator affected="yes" class="_ID18_LivelloClasseInfra" field="_ID18_ChiaveClasseInfra">
            <generator affected="yes" class="_ID19_LivelloInfrastrutturale" field="_ID19_LivelloInfrastrutturaleKey" hold="yes">
              <generator affected="yes" class="_ID20_LivelloServer" field="_ID20_LivelloServerKey" hold="yes"/>
            </generator>
          </generator>
        </generator>
      </generator>
    </generator>
  </group>
  <group affected="no" class="_ID0_Import_Data" name="Import Data">
    <generator affected="yes" class="_ID7_ISP_AmbitoCluster" field="_ID7_CIAmbito">
      <generator affected="yes" class="_ID8_ISP_Servizio" field="_ID8_CIServizio">
        <generator affected="yes" class="_ID9_ISP_AreaTecnologica" field="_ID9_CIAreaTecnologica">
          <generator affected="yes" class="_ID10_ISP_LivelloArchitettura" field="_ID10_CIArchitettura">
            <generator affected="yes" class="_ID13_ISP_Cluster" field="_ID13_CICLuster">
              <generator affected="yes" class="_ID14_ISP_Server" field="_ID14_ISP_ServerKey" hold="yes">
                <generator affected="yes" class="_ID15_ISP_Risorsa" field="_ID15_ISP_RisorsaKey" hold="yes"/>
              </generator>
            </generator>
          </generator>
        </generator>
      </generator>
    </generator>
    <generator affected="yes" class="_ID1_ISP_Ambito" field="_ID1_CIAmbito">
      <generator affected="yes" class="_ID2_ISP_Servizio" field="_ID2_CIServizio">
        <generator affected="yes" class="_ID3_ISP_AreaTecnologica" field="_ID3_CIAreaTecnologica">
          <generator affected="yes" class="_ID4_ISP_LivelloArchitettura" field="_ID4_CIArchitettura">
            <generator affected="yes" class="_ID5_ISP_Server" field="_ID5_ServerKey" hold="yes">
              <generator affected="yes" class="_ID6_ISP_Risorsa" field="_ID6_DBElement1Key" hold="yes"/>
            </generator>
          </generator>
        </generator>
      </generator>
    </generator>
  </group>
  <group affected="no" class="_ID28_Clusters" name="Clusters">
    <generator affected="yes" class="_ID29_Cluster" field="_ID29_ClusterKey" hold="yes"/>
  </group>
</hierarchy>
