<?xml version="1.0" encoding="UTF-8" standalone="no"?>
<!DOCTYPE hierarchy PUBLIC "-//Novell, Inc.//DTD hierarchy 2.0//EN" "http://www.Novell.com/dtds/hierarchy_2.0.dtd">
<hierarchy>

<!--
   This Hierarchy File is automatically generated by BDI to allow the BDI Definition to function properly.
   Do not hand edit this Hierarchy File or the BDI Integration may not function properly.
   Any desired modifications should be made within the BDI IDE and the definition re-deployed.
-->

<group affected="no" class="_ID7_PSH_ServiceGV" name="PSH ServiceGV">
    <generator affected="yes" class="_ID8_LivelloServizioGlobalView" field="_ID8_ServizioGlobalView">
      <generator affected="yes" class="_ID9_LivelloServizio" field="_ID9_Servizio">
        <!--Hierarchy XML Start-->
        <properties>
<page name="Percorso">
<property computeOnGet="false" field="Servizio" function="LAST" name="Servizio"/>
<property computeOnGet="false" field="exportSource" function="LAST" name="exportSource"/>
<property computeOnGet="false" field="exportDt" function="LAST" name="exportDt"/>
</page>
</properties>
        <!--Hierarchy XML End-->
        <generator affected="yes" class="_ID10_LivelloSSA" field="_ID10_SSA">
          <!--Hierarchy XML Start-->
          <properties>
<page name="Percorso">
<property computeOnGet="false" field="Servizio" function="LAST" name="Servizio"/>
<property computeOnGet="false" field="SSA" function="LAST" name="SSA"/>
<property computeOnGet="false" field="exportSource" function="LAST" name="exportSource"/>
<property computeOnGet="false" field="exportDt" function="LAST" name="exportDt"/>
</page>
</properties>
          <!--Hierarchy XML End-->
          <generator affected="yes" class="_ID11_LivelloAcronimo" field="_ID11_Acronimo">
            <!--Hierarchy XML Start-->
            <properties>
<page name="Percorso">
<property computeOnGet="false" field="Servizio" function="LAST" name="Servizio"/>
<property computeOnGet="false" field="SSA" function="LAST" name="SSA"/>
<property computeOnGet="false" field="Acronimo" function="LAST" name="Acronimo"/>
<property computeOnGet="false" field="Descrizione" function="LAST" name="Descrizione"/>
<property computeOnGet="false" field="Descrizione" function="LAST" name="Description"/>
<property computeOnGet="false" field="exportSource" function="LAST" name="exportSource"/>
<property computeOnGet="false" field="exportDt" function="LAST" name="exportDt"/>
</page>
</properties>
            <!--Hierarchy XML End-->
            <generator affected="yes" class="_ID12_LivelloClasseCompInfra" field="_ID12_ClasseCompInfra">
              <!--Hierarchy XML Start-->
              <properties>
<page name="Percorso">
<property computeOnGet="false" field="Servizio" function="LAST" name="Servizio"/>
<property computeOnGet="false" field="SSA" function="LAST" name="SSA"/>
<property computeOnGet="false" field="Acronimo" function="LAST" name="Acronimo"/>
<property computeOnGet="false" field="ClasseCompInfra" function="LAST" name="ClasseCompInfra"/>
<property computeOnGet="false" field="exportSource" function="LAST" name="exportSource"/>
<property computeOnGet="false" field="exportDt" function="LAST" name="exportDt"/>
</page>
</properties>
              <!--Hierarchy XML End-->
              <generator affected="yes" class="_ID13_LivelloCompInfra" field="_ID13_CompInfra">
                <!--Hierarchy XML Start-->
                <properties>
<page name="Percorso">
<property computeOnGet="false" field="Servizio" function="LAST" name="Servizio"/>
<property computeOnGet="false" field="SSA" function="LAST" name="SSA"/>
<property computeOnGet="false" field="Acronimo" function="LAST" name="Acronimo"/>
<property computeOnGet="false" field="ClasseCompInfra" function="LAST" name="ClasseCompInfra"/>
<property computeOnGet="false" field="CompInfra" function="LAST" name="CompInfra"/>
<property computeOnGet="false" field="exportSource" function="LAST" name="exportSource"/>
<property computeOnGet="false" field="exportDt" function="LAST" name="exportDt"/>
</page>
</properties>
                <!--Hierarchy XML End-->
                <generator affected="yes" class="_ID22_LivelloRisorsa" field="_ID22_LivelloRisorsaKey" hold="yes">
                  <!--Hierarchy XML Start-->
                  <!--NOTE: Could not parse hierarchy text: <properties>
<page name="Percorso">
<property computeOnGet="false" field="Serviz....-->
                  <!--Hierarchy XML End-->
                </generator>
              </generator>
            </generator>
          </generator>
        </generator>
      </generator>
    </generator>
  </group>
</hierarchy>
