<?xml version="1.0" encoding="UTF-8"?>
<!DOCTYPE hierarchy PUBLIC "-//Novell, Inc.//DTD hierarchy 2.0//EN"
                           "http://www.Novell.com/dtds/hierarchy_2.0.dtd">
<hierarchy>
    <!--
   This Hierarchy File is automatically generated by BDI to allow the BDI Definition to function properly.
   Do not hand edit this Hierarchy File or the BDI Integration may not function properly.
   Any desired modifications should be made within the BDI IDE and the definition re-deployed.
-->
    <group affected="no" class="gen_folder" name="StrutturaDaAllarmi">
        <generator class="ServizioGlobalView" field="ServizioGV">
            <generator affected="yes" class="Servizio" field="Servizio" hold="no">
                <properties>
                    <page name="Percorso">
                        <property computeOnGet="false" field="Servizio" function="LAST" name="Servizio"/>
                    </page>
                </properties>
                <generator affected="yes" class="SSA" field="SSA" hold="no">
                    <properties>
                        <page name="Percorso">
                            <property computeOnGet="false" field="Servizio" function="LAST" name="Servizio"/>
                            <property computeOnGet="false" field="SSA" function="LAST" name="SSA"/>
                        </page>
                    </properties>
                    <generator affected="yes" class="Acronimo" field="Acronimo" hold="no">
                        <properties>
                            <page name="Percorso">
                                <property computeOnGet="false" field="Servizio" function="LAST" name="Servizio"/>
                                <property computeOnGet="false" field="SSA" function="LAST" name="SSA"/>
                                <property computeOnGet="false" field="Acronimo" function="LAST" name="Acronimo"/>
                                <property computeOnGet="false" field="Descrizione" function="LAST" name="Descrizione"/>
                                <property computeOnGet="false" field="Descrizione" function="LAST" name="Description"/>
                            </page>
                        </properties>
                        <generator affected="yes" class="ClasseCompInfra" field="ClasseCompInfra" hold="no">
                            <properties>
                                <page name="Percorso">
                                    <property computeOnGet="false" field="Servizio" function="LAST" name="Servizio"/>
                                    <property computeOnGet="false" field="SSA" function="LAST" name="SSA"/>
                                    <property computeOnGet="false" field="Acronimo" function="LAST" name="Acronimo"/>
                                    <property computeOnGet="false" field="ClasseCompInfra" function="LAST" name="ClasseCompInfra"/>
                                </page>
                            </properties>
                            <generator affected="yes" class="CompInfra" field="CompInfra" hold="no">
                                <properties>
                                    <page name="Percorso">
                                        <property computeOnGet="false" field="Servizio" function="LAST" name="Servizio"/>
                                        <property computeOnGet="false" field="SSA" function="LAST" name="SSA"/>
                                        <property computeOnGet="false" field="Acronimo" function="LAST" name="Acronimo"/>
                                        <property computeOnGet="false" field="ClasseCompInfra" function="LAST" name="ClasseCompInfra"/>
                                        <property computeOnGet="false" field="CompInfra" function="LAST" name="CompInfra"/>
                                    </page>
                                </properties>
                                <generator affected="yes" class="Risorsa" field="Risorsa" hold="yes">
                                    <filter invert="false" operator="and">
                                        <test expr="@custom/checkSvcMdlStruct.fs" invert="false" type="script"/>
                                    </filter>
                                    <properties>
                                        <page name="Percorso">
                                            <property computeOnGet="false" field="Servizio" function="LAST" name="Servizio"/>
                                            <property computeOnGet="false" field="SSA" function="LAST" name="SSA"/>
                                            <property computeOnGet="false" field="Acronimo" function="LAST" name="Acronimo"/>
                                            <property computeOnGet="false" field="Descrizione" function="LAST" name="Descrizione"/>
                                            <property computeOnGet="false" field="ClasseCompInfra" function="LAST" name="ClasseCompInfra"/>
                                            <property computeOnGet="false" field="CompInfra" function="LAST" name="CompInfra"/>
                                            <property computeOnGet="false" field="Risorsa" function="LAST" name="Risorsa"/>
                                            <property computeOnGet="false" field="Server" function="LAST" name="Server"/>
                                            <property computeOnGet="false" field="ChiaveAllarme" function="LAST" name="ServerRisorsa"/>
                                        </page>
                                    </properties>
                                </generator>
                            </generator>
                        </generator>
                    </generator>
                </generator>
            </generator>
        </generator>
    </group>
</hierarchy>
