<?xml version="1.0" encoding="UTF-8"?>
<!DOCTYPE hierarchy PUBLIC "-//Novell, Inc.//DTD hierarchy 2.0//EN" "database/examples/hierarchy_2.0.dtd">


<!--
 Copyright (c) 2014 NetIQ Corporation.  All Rights Reserved.

 THIS WORK IS SUBJECT TO U.S. AND INTERNATIONAL COPYRIGHT LAWS AND TREATIES.  IT MAY NOT BE USED, COPIED,
 DISTRIBUTED, DISCLOSED, ADAPTED, PERFORMED, DISPLAYED, COLLECTED, COMPILED, OR LINKED WITHOUT NETIQ'S
 PRIOR WRITTEN CONSENT. USE OR EXPLOITATION OF THIS WORK WITHOUT AUTHORIZATION COULD SUBJECT THE
 PERPETRATOR TO CRIMINAL AND CIVIL LIABILITY.

 NETIQ PROVIDES THE WORK "AS IS," WITHOUT ANY EXPRESS OR IMPLIED WARRANTY, INCLUDING WITHOUT THE
 IMPLIED WARRANTIES OF MERCHANTABILITY, FITNESS FOR A PARTICULAR PURPOSE, AND NON-INFRINGEMENT. NETIQ,
 THE AUTHORS OF THE WORK, AND THE OWNERS OF COPYRIGHT IN THE WORK ARE NOT LIABLE FOR ANY CLAIM,
 DAMAGES, OR OTHER LIABILITY, WHETHER IN AN ACTION OF CONTRACT, TORT, OR OTHERWISE, ARISING FROM, OUT OF,
 OR IN CONNECTION WITH THE WORK OR THE USE OR OTHER DEALINGS IN THE WORK.
-->

<!--
     Please refer to the hierarchy.dtd file in your Formula(tm)
     installation directory for details on the definition of this file. 
     
     In this file, you can specify alarm fields in order to generate
     new elements or compare field values.
     
     The fields available for Tivoli Enterprise Console are:

     Field Name     Value
     ==========     =====
     id             alarm ID (internal to Formula)
     severity       Possible values are "CRITICAL", "MAJOR", "MINOR", "INFORMATIONAL", and "OK"
     date           most recent alarm date and time, in normal format
     
     Also, any slot name can be used as an alarm field value.
     
-->
<hierarchy>
  <group class="Sources" name="Sources">
    <generator affected="yes" field="mc_client_address"/>
  </group>
  <group class="Cells" name="Cells">
    <generator class="Cell" field="cellname"/>
  </group>
  <group class="Hosts" name="Hosts">
    <generator class="host" field="mc_host"/>
  </group>
  <group class="barIndet" name="Severities">
    <group class="barCritical" name="Critical/Fatal">
      <filter>
        <field name="severity" value="CRITICAL"/>
      </filter>
    </group>
    <group class="barHarmless" name="Harmless">
      <filter>
        <field name="severity" value="INFORMATIONAL"/>
      </filter>
    </group>
    <group class="barMinor" name="Minor">
      <filter>
        <field name="severity" value="MINOR"/>
      </filter>
    </group>
    <group class="barOK" name="OK">
      <filter>
        <field name="severity" value="OK"/>
      </filter>
    </group>
    <group affected="no" class="barWarning" name="Warning">
      <filter invert="false" operator="and">
        <field invert="false" name="severity" operator="equals" value="MAJOR"/>
      </filter>
    </group>
  </group>
</hierarchy>
